{"$schema":"https://json-schema.org/draft/2020-12/schema","title":"Axiomatic Runtime Profile","type":"object","required":["schemaVersion","name","origin","policy"],"properties":{"schemaVersion":{"const":"1.0"},"name":{"type":"string","minLength":1},"origin":{"enum":["zdx-validated","customer-modified"]},"policy":{"type":"object","required":["allowedCommands","allowedTools","mutatingTools","nonMutatingCommands"],"properties":{"allowedCommands":{"type":"array","items":{"type":"string"},"uniqueItems":true},"allowedTools":{"type":"array","items":{"type":"string"},"uniqueItems":true},"mutatingTools":{"type":"array","items":{"type":"string"},"uniqueItems":true},"nonMutatingCommands":{"type":"array","items":{"type":"string"},"uniqueItems":true}},"additionalProperties":false}},"additionalProperties":false}